;Sentiment;Text Tweet;step01;tokens;tokens_perbaikan;Stop_removal;step02;ProcessedText
193;1;<PROVIDER_NAME> BagiBerkah ...gak ada kata susah ..cukup sekali sentuh jadi mudah dan berfaedah;provider_name bagiberkah repeated gak ada kata susah repeated cukup sekali sentuh jadi mudah dan berfaedah;['provider_name', 'bagiberkah', 'repeated', 'gak', 'ada', 'kata', 'susah', 'repeated', 'cukup', 'sekali', 'sentuh', 'jadi', 'mudah', 'dan', 'berfaedah'];['provider_name', 'bagiberkah', 'repeated', 'tidak', 'ada', 'kata', 'susah', 'repeated', 'cukup', 'sekali', 'sentuh', 'jadi', 'mudah', 'dan', 'berfaedah'];['provider_name', 'bagiberkah', 'repeated', 'susah', 'repeated', 'sentuh', 'mudah', 'berfaedah'];provider_name bagiberkah repeated susah repeated sentuh mudah berfaedah;provider name bagiberkah repeated susah repeated sentuh mudah faedah
194;0;<PROVIDER_NAME> tumbang di kota Semarang;provider_name tumbang di kota semarang;['provider_name', 'tumbang', 'di', 'kota', 'semarang'];['provider_name', 'tumbang', 'di', 'kota', 'semarang'];['provider_name', 'tumbang', 'kota', 'semarang'];provider_name tumbang kota semarang;provider name tumbang kota semarang
195;0;Kuotaku masih banyak internetan aja gak bisa <PROVIDER_NAME> <PROVIDER_NAME>Care <PROVIDER_NAME> ;kuotaku masih banyak internetan aja gak bisa provider_name provider_name care provider_name;['kuotaku', 'masih', 'banyak', 'internetan', 'aja', 'gak', 'bisa', 'provider_name', 'provider_name', 'care', 'provider_name'];['kuotaku', 'masih', 'banyak', 'internetan', 'saja', 'tidak', 'bisa', 'provider_name', 'provider_name', 'care', 'provider_name'];['kuotaku', 'internetan', 'provider_name', 'provider_name', 'care', 'provider_name'];kuotaku internetan provider_name provider_name care provider_name;kuota internetan provider name provider name care provider name
196;0;Selalu Lemot <PROVIDER_NAME>;selalu lemot provider_name;['selalu', 'lemot', 'provider_name'];['selalu', 'lemot', 'provider_name'];['lemot', 'provider_name'];lemot provider_name;lot provider name
197;1;<PROVIDER_NAME> BerbagiBerkah karena berbagi itu menyenangkan apalagi sama orang yang kita sayangi.;provider_name berbagiberkah karena berbagi itu menyenangkan apalagi sama orang yang kita sayangi;['provider_name', 'berbagiberkah', 'karena', 'berbagi', 'itu', 'menyenangkan', 'apalagi', 'sama', 'orang', 'yang', 'kita', 'sayangi'];['provider_name', 'berbagiberkah', 'karena', 'berbagi', 'itu', 'menyenangkan', 'apalagi', 'sama', 'orang', 'yang', 'kita', 'sayangi'];['provider_name', 'berbagiberkah', 'berbagi', 'menyenangkan', 'orang', 'sayangi'];provider_name berbagiberkah berbagi menyenangkan orang sayangi;provider name berbagiberkah bagi senang orang sayang
198;1;Santai pakai <PROVIDER_NAME> <PROVIDER_NAME>4G <PROVIDER_NAME>BagiBerkah bisa diandalkan;santai pakai provider_name provider_name 4 provider_name bagiberkah bisa diandalkan;['santai', 'pakai', 'provider_name', 'provider_name', '4', 'provider_name', 'bagiberkah', 'bisa', 'diandalkan'];['santai', 'pakai', 'provider_name', 'provider_name', '4', 'provider_name', 'bagiberkah', 'bisa', 'diandalkan'];['santai', 'pakai', 'provider_name', 'provider_name', '4', 'provider_name', 'bagiberkah', 'diandalkan'];santai pakai provider_name provider_name 4 provider_name bagiberkah diandalkan;santai pakai provider name provider name 4 provider name bagiberkah andal
199;1;banyak yang masih setia memggunakan <PROVIDER_NAME>;banyak yang masih setia memggunakan provider_name;['banyak', 'yang', 'masih', 'setia', 'memggunakan', 'provider_name'];['banyak', 'yang', 'masih', 'setia', 'memggunakan', 'provider_name'];['setia', 'memggunakan', 'provider_name'];setia memggunakan provider_name;setia memggunakan provider name
200;1;Yang saya pengen <PROVIDER_NAME> selangkah lebih maju dari yang lain baik layanan ataupun jaringan 3G atau 4G,;yang saya pengen provider_name selangkah lebih maju dari yang lain baik layanan ataupun jaringan 3 atau 4;['yang', 'saya', 'pengen', 'provider_name', 'selangkah', 'lebih', 'maju', 'dari', 'yang', 'lain', 'baik', 'layanan', 'ataupun', 'jaringan', '3', 'atau', '4'];['yang', 'saya', 'ingin', 'provider_name', 'selangkah', 'lebih', 'maju', 'dari', 'yang', 'lain', 'baik', 'layanan', 'ataupun', 'jaringan', '3', 'atau', '4'];['provider_name', 'selangkah', 'maju', 'layanan', 'jaringan', '3', '4'];provider_name selangkah maju layanan jaringan 3 4;provider name selang maju layan jaring 3 4
201;1;Yuk pakai <PROVIDER_NAME> Rp1 gratis 1GB;yuk pakai provider_name rp1 gratis 1 gb;['yuk', 'pakai', 'provider_name', 'rp1', 'gratis', '1', 'gb'];['ayo', 'pakai', 'provider_name', 'rp1', 'gratis', '1', 'gb'];['ayo', 'pakai', 'provider_name', 'rp1', 'gratis', '1', 'gb'];ayo pakai provider_name rp1 gratis 1 gb;ayo pakai provider name rp1 gratis 1 gb
202;1;Lebaran tetap pakai <PROVIDER_NAME> yaa #Rp1 gratis 1GB;lebaran tetap pakai provider_name yaa hashtag rp 1 hashtag gratis 1 gb;['lebaran', 'tetap', 'pakai', 'provider_name', 'yaa', 'hashtag', 'rp', '1', 'hashtag', 'gratis', '1', 'gb'];['lebaran', 'tetap', 'pakai', 'provider_name', 'iya', 'hashtag', 'rupiah', '1', 'hashtag', 'gratis', '1', 'gb'];['lebaran', 'pakai', 'provider_name', 'iya', 'hashtag', 'rupiah', '1', 'hashtag', 'gratis', '1', 'gb'];lebaran pakai provider_name iya hashtag rupiah 1 hashtag gratis 1 gb;lebaran pakai provider name iya hashtag rupiah 1 hashtag gratis 1 gb
203;1;sinyal 4G <PROVIDER_NAME> dipalembang lancar;sinyal 4 provider_name dipalembang lancar;['sinyal', '4', 'provider_name', 'dipalembang', 'lancar'];['sinyal', '4', 'provider_name', 'dipalembang', 'lancar'];['sinyal', '4', 'provider_name', 'dipalembang', 'lancar'];sinyal 4 provider_name dipalembang lancar;sinyal 4 provider name dipalembang lancar
204;1;Keren di rembang ada sinyal 4G <PROVIDER_NAME>;keren di rembang ada sinyal 4 provider_name;['keren', 'di', 'rembang', 'ada', 'sinyal', '4', 'provider_name'];['keren', 'di', 'rembang', 'ada', 'sinyal', '4', 'provider_name'];['keren', 'rembang', 'sinyal', '4', 'provider_name'];keren rembang sinyal 4 provider_name;keren rembang sinyal 4 provider name
205;1;sinyal <PROVIDER_NAME> kuat banget;sinyal provider_name kuat banget;['sinyal', 'provider_name', 'kuat', 'banget'];['sinyal', 'provider_name', 'kuat', 'banget'];['sinyal', 'provider_name', 'kuat', 'banget'];sinyal provider_name kuat banget;sinyal provider name kuat banget
206;1;4G <PROVIDER_NAME> dapat banget disini;4 provider_name dapat banget disini;['4', 'provider_name', 'dapat', 'banget', 'disini'];['4', 'provider_name', 'dapat', 'banget', 'disini'];['4', 'provider_name', 'banget'];4 provider_name banget;4 provider name banget
207;1;Berkat <PROVIDER_NAME> mudiknya jd nyaman,mampir ke posko pun senang..;berkat provider_name mudiknya jd nyaman mampir ke posko pun senang repeated;['berkat', 'provider_name', 'mudiknya', 'jd', 'nyaman', 'mampir', 'ke', 'posko', 'pun', 'senang', 'repeated'];['berkat', 'provider_name', 'mudiknya', 'jadi ', 'nyaman', 'mampir', 'ke', 'posko', 'pun', 'senang', 'repeated'];['berkat', 'provider_name', 'mudiknya', 'jadi ', 'nyaman', 'mampir', 'posko', 'senang', 'repeated'];berkat provider_name mudiknya jadi  nyaman mampir posko senang repeated;berkat provider name mudik jadi nyaman mampir posko senang repeated
208;1;Terimakasih <PROVIDER_NAME>;terimakasih provider_name;['terimakasih', 'provider_name'];['terimakasih', 'provider_name'];['terimakasih', 'provider_name'];terimakasih provider_name;terimakasih provider name
209;1;untungnya sudah pakai <PROVIDER_NAME>;untungnya sudah pakai provider_name;['untungnya', 'sudah', 'pakai', 'provider_name'];['untungnya', 'sudah', 'pakai', 'provider_name'];['untungnya', 'pakai', 'provider_name'];untungnya pakai provider_name;untung pakai provider name
210;1;Alhamdulillah masih #setia dengan <PROVIDER_NAME>.. terbaik;alhamdulillah masih hashtag setia hashtag dengan provider_name repeated terbaik;['alhamdulillah', 'masih', 'hashtag', 'setia', 'hashtag', 'dengan', 'provider_name', 'repeated', 'terbaik'];['syukur', 'masih', 'hashtag', 'setia', 'hashtag', 'dengan', 'provider_name', 'repeated', 'terbaik'];['syukur', 'hashtag', 'setia', 'hashtag', 'provider_name', 'repeated', 'terbaik'];syukur hashtag setia hashtag provider_name repeated terbaik;syukur hashtag setia hashtag provider name repeated baik
211;1;<PROVIDER_NAME> memang jauh lebih murah dari <PROVIDER_NAME>, banyak bonusnya lagi;provider_name memang jauh lebih murah dari provider_name banyak bonusnya lagi;['provider_name', 'memang', 'jauh', 'lebih', 'murah', 'dari', 'provider_name', 'banyak', 'bonusnya', 'lagi'];['provider_name', 'memang', 'jauh', 'lebih', 'murah', 'dari', 'provider_name', 'banyak', 'bonusnya', 'lagi'];['provider_name', 'murah', 'provider_name', 'bonusnya'];provider_name murah provider_name bonusnya;provider name murah provider name bonus
212;0;RT <USER_MENTION>: Buat <PROVIDER_NAME> setelah kuota habis saya mau ganti provider  ;rt user_mention buat provider_name setelah kuota habis saya mau ganti provider;['rt', 'user_mention', 'buat', 'provider_name', 'setelah', 'kuota', 'habis', 'saya', 'mau', 'ganti', 'provider'];['rt', 'user_mention', 'buat', 'provider_name', 'setelah', 'kuota', 'habis', 'saya', 'mau', 'ganti', 'provider'];['rt', 'user_mention', 'provider_name', 'kuota', 'habis', 'ganti', 'provider'];rt user_mention provider_name kuota habis ganti provider;rt user mention provider name kuota habis ganti provider
213;0;<PROVIDER_NAME> memang jancok! sinyal payah;provider_name memang jancok sinyal payah;['provider_name', 'memang', 'jancok', 'sinyal', 'payah'];['provider_name', 'memang', 'jancok', 'sinyal', 'payah'];['provider_name', 'jancok', 'sinyal', 'payah'];provider_name jancok sinyal payah;provider name jancok sinyal payah
214;0;saya paling tidak pernah pakai  <PROVIDER_NAME>;saya paling tidak pernah pakai provider_name;['saya', 'paling', 'tidak', 'pernah', 'pakai', 'provider_name'];['saya', 'paling', 'tidak', 'pernah', 'pakai', 'provider_name'];['pakai', 'provider_name'];pakai provider_name;pakai provider name
215;0;RT <USER_MENTION>: Belum ada permintaan maaf dan pernyataan apapun?  Lanjut boikot <PROVIDER_NAME> #Boikot<PROVIDER_NAME> <URL>;rt user_mention belum ada permintaan maaf dan pernyataan apapun lanjut boikot provider_name hashtag boikot hashtag provider_name allcaps url allcaps;['rt', 'user_mention', 'belum', 'ada', 'permintaan', 'maaf', 'dan', 'pernyataan', 'apapun', 'lanjut', 'boikot', 'provider_name', 'hashtag', 'boikot', 'hashtag', 'provider_name', 'allcaps', 'url', 'allcaps'];['rt', 'user_mention', 'belum', 'ada', 'permintaan', 'maaf', 'dan', 'pernyataan', 'apapun', 'lanjut', 'boikot', 'provider_name', 'hashtag', 'boikot', 'hashtag', 'provider_name', 'allcaps', 'url', 'allcaps'];['rt', 'user_mention', 'permintaan', 'maaf', 'pernyataan', 'apapun', 'boikot', 'provider_name', 'hashtag', 'boikot', 'hashtag', 'provider_name', 'allcaps', 'url', 'allcaps'];rt user_mention permintaan maaf pernyataan apapun boikot provider_name hashtag boikot hashtag provider_name allcaps url allcaps;rt user mention minta maaf nyata apa boikot provider name hashtag boikot hashtag provider name allcaps url allcaps
216;0;<PROVIDER_NAME> masa kuota malam saya sudah habis duluan? Logikanya dimana? <URL>;provider_name masa kuota malam saya sudah habis duluan logikanya dimana allcaps url allcaps;['provider_name', 'masa', 'kuota', 'malam', 'saya', 'sudah', 'habis', 'duluan', 'logikanya', 'dimana', 'allcaps', 'url', 'allcaps'];['provider_name', 'masa', 'kuota', 'malam', 'saya', 'sudah', 'habis', 'dahulu', 'logikanya', 'dimana', 'allcaps', 'url', 'allcaps'];['provider_name', 'kuota', 'malam', 'habis', 'logikanya', 'dimana', 'allcaps', 'url', 'allcaps'];provider_name kuota malam habis logikanya dimana allcaps url allcaps;provider name kuota malam habis logika mana allcaps url allcaps
217;0;RT <USER_MENTION>: <PROVIDER_NAME> ini <PROVIDER_NAME> di sini jaringan 4G nya penuh, cuma ga mau konek ke internet...;rt user_mention provider_name ini provider_name di sini jaringan 4 nya penuh cuma ga mau konek ke internet repeated;['rt', 'user_mention', 'provider_name', 'ini', 'provider_name', 'di', 'sini', 'jaringan', '4', 'nya', 'penuh', 'cuma', 'ga', 'mau', 'konek', 'ke', 'internet', 'repeated'];['rt', 'user_mention', 'provider_name', 'ini', 'provider_name', 'di', 'sini', 'jaringan', '4', 'nya', 'penuh', 'cuma', 'tidak', 'mau', 'konek', 'ke', 'internet', 'repeated'];['rt', 'user_mention', 'provider_name', 'provider_name', 'jaringan', '4', 'nya', 'penuh', 'konek', 'internet', 'repeated'];rt user_mention provider_name provider_name jaringan 4 nya penuh konek internet repeated;rt user mention provider name provider name jaring 4 nya penuh konek internet repeated
218;1;Sinyal 4g nya stabil nih. mantap <PROVIDER_NAME> <URL>;sinyal 4 nya stabil nih mantap provider_name allcaps url allcaps;['sinyal', '4', 'nya', 'stabil', 'nih', 'mantap', 'provider_name', 'allcaps', 'url', 'allcaps'];['sinyal', '4', 'nya', 'stabil', 'ini', 'mantap', 'provider_name', 'allcaps', 'url', 'allcaps'];['sinyal', '4', 'nya', 'stabil', 'mantap', 'provider_name', 'allcaps', 'url', 'allcaps'];sinyal 4 nya stabil mantap provider_name allcaps url allcaps;sinyal 4 nya stabil mantap provider name allcaps url allcaps
219;0;Fungsinya data lokal, 4G sama Flash apa? Toh mau 4G atau 3G yang terpakai duluan data lokalnya. mahal lagi. <PROVIDER_NAME>;fungsinya data lokal 4 sama flash apa toh mau 4 atau 3 yang terpakai duluan data lokalnya mahal lagi provider_name;['fungsinya', 'data', 'lokal', '4', 'sama', 'flash', 'apa', 'toh', 'mau', '4', 'atau', '3', 'yang', 'terpakai', 'duluan', 'data', 'lokalnya', 'mahal', 'lagi', 'provider_name'];['fungsinya', 'data', 'lokal', '4', 'sama', 'flash', 'apa', 'toh', 'mau', '4', 'atau', '3', 'yang', 'terpakai', 'dahulu', 'data', 'lokalnya', 'mahal', 'lagi', 'provider_name'];['fungsinya', 'data', 'lokal', '4', 'flash', '4', '3', 'terpakai', 'data', 'lokalnya', 'mahal', 'provider_name'];fungsinya data lokal 4 flash 4 3 terpakai data lokalnya mahal provider_name;fungsi data lokal 4 flash 4 3 pakai data lokal mahal provider name
220;1;Hore, dapat makan malam gratis hari ini karena <PROVIDER_NAME> Poin  #7eleven #sevel <PROVIDER_NAME>… <URL>;hore dapat makan malam gratis hari ini karena provider_name poin hashtag 7 el even hashtag hashtag sevel hashtag provider_name allcaps url allcaps;['hore', 'dapat', 'makan', 'malam', 'gratis', 'hari', 'ini', 'karena', 'provider_name', 'poin', 'hashtag', '7', 'el', 'even', 'hashtag', 'hashtag', 'sevel', 'hashtag', 'provider_name', 'allcaps', 'url', 'allcaps'];['hore', 'dapat', 'makan', 'malam', 'gratis', 'hari', 'ini', 'karena', 'provider_name', 'poin', 'hashtag', '7', 'el', 'even', 'hashtag', 'hashtag', 'sevel', 'hashtag', 'provider_name', 'allcaps', 'url', 'allcaps'];['hore', 'makan', 'malam', 'gratis', 'provider_name', 'poin', 'hashtag', '7', 'el', 'even', 'hashtag', 'hashtag', 'sevel', 'hashtag', 'provider_name', 'allcaps', 'url', 'allcaps'];hore makan malam gratis provider_name poin hashtag 7 el even hashtag hashtag sevel hashtag provider_name allcaps url allcaps;hore makan malam gratis provider name poin hashtag 7 el even hashtag hashtag sevel hashtag provider name allcaps url allcaps
221;0;Wajar saja <PROVIDER_NAME> dihack, harga mahal banget dan koneksi lambat lagi <PROVIDER_NAME>mahal <PROVIDER_NAME> ;wajar saja provider_name dihack harga mahal banget dan koneksi lambat lagi provider_name mahal provider_name;['wajar', 'saja', 'provider_name', 'dihack', 'harga', 'mahal', 'banget', 'dan', 'koneksi', 'lambat', 'lagi', 'provider_name', 'mahal', 'provider_name'];['wajar', 'saja', 'provider_name', 'dihack', 'harga', 'mahal', 'banget', 'dan', 'koneksi', 'lambat', 'lagi', 'provider_name', 'mahal', 'provider_name'];['wajar', 'provider_name', 'dihack', 'harga', 'mahal', 'banget', 'koneksi', 'lambat', 'provider_name', 'mahal', 'provider_name'];wajar provider_name dihack harga mahal banget koneksi lambat provider_name mahal provider_name;wajar provider name dihack harga mahal banget koneksi lambat provider name mahal provider name
222;1;*ganti* paket <PROVIDER_NAME>  5Gb langsung lancar dan #TransaksiNormal;ganti emphasis paket provider_name 5 gb langsung lancar dan hashtag transaksi normal hashtag;['ganti', 'emphasis', 'paket', 'provider_name', '5', 'gb', 'langsung', 'lancar', 'dan', 'hashtag', 'transaksi', 'normal', 'hashtag'];['ganti', 'emphasis', 'paket', 'provider_name', '5', 'gb', 'langsung', 'lancar', 'dan', 'hashtag', 'transaksi', 'normal', 'hashtag'];['ganti', 'emphasis', 'paket', 'provider_name', '5', 'gb', 'langsung', 'lancar', 'hashtag', 'transaksi', 'normal', 'hashtag'];ganti emphasis paket provider_name 5 gb langsung lancar hashtag transaksi normal hashtag;ganti emphasis paket provider name 5 gb langsung lancar hashtag transaksi normal hashtag
223;0;Selalu saja ada masalah #Indonesia <PROVIDER_NAME> #konsumen <USER_MENTION>;selalu saja ada masalah hashtag indonesia hashtag provider_name hashtag on sum en hashtag user_mention;['selalu', 'saja', 'ada', 'masalah', 'hashtag', 'indonesia', 'hashtag', 'provider_name', 'hashtag', 'on', 'sum', 'en', 'hashtag', 'user_mention'];['selalu', 'saja', 'ada', 'masalah', 'hashtag', 'indonesia', 'hashtag', 'provider_name', 'hashtag', 'on', 'sum', 'en', 'hashtag', 'user_mention'];['hashtag', 'indonesia', 'hashtag', 'provider_name', 'hashtag', 'on', 'sum', 'en', 'hashtag', 'user_mention'];hashtag indonesia hashtag provider_name hashtag on sum en hashtag user_mention;hashtag indonesia hashtag provider name hashtag on sum en hashtag user mention
224;1;Alhamdulillah gratisan youtube dari <PROVIDER_NAME> pada bulan Ramadhan ini berfaedah sekali.;alhamdulillah gratisan youtube dari provider_name pada bulan ramadhan ini berfaedah sekali;['alhamdulillah', 'gratisan', 'youtube', 'dari', 'provider_name', 'pada', 'bulan', 'ramadhan', 'ini', 'berfaedah', 'sekali'];['syukur', 'gratisan', 'youtube', 'dari', 'provider_name', 'pada', 'bulan', 'ramadhan', 'ini', 'berfaedah', 'sekali'];['syukur', 'gratisan', 'youtube', 'provider_name', 'ramadhan', 'berfaedah'];syukur gratisan youtube provider_name ramadhan berfaedah;syukur gratis youtube provider name ramadhan faedah
225;0;<PROVIDER_NAME> KENAPA. sinyal hilang mulu;provider_name allcaps kenapa allcaps sinyal hilang mulu;['provider_name', 'allcaps', 'kenapa', 'allcaps', 'sinyal', 'hilang', 'mulu'];['provider_name', 'allcaps', 'kenapa', 'allcaps', 'sinyal', 'hilang', 'mulu'];['provider_name', 'allcaps', 'allcaps', 'sinyal', 'hilang', 'mulu'];provider_name allcaps allcaps sinyal hilang mulu;provider name allcaps allcaps sinyal hilang mulu
226;0;Data yang sama sekali tidak ada manfaatnya.  <PROVIDER_NAME> <URL> …;data yang sama sekali tidak ada manfaatnya provider_name allcaps url allcaps;['data', 'yang', 'sama', 'sekali', 'tidak', 'ada', 'manfaatnya', 'provider_name', 'allcaps', 'url', 'allcaps'];['data', 'yang', 'sama', 'sekali', 'tidak', 'ada', 'manfaatnya', 'provider_name', 'allcaps', 'url', 'allcaps'];['data', 'manfaatnya', 'provider_name', 'allcaps', 'url', 'allcaps'];data manfaatnya provider_name allcaps url allcaps;data manfaat provider name allcaps url allcaps
227;0;<PROVIDER_NAME> goblok banget sih sekarang <PROVIDER_NAME> #jadimurahan ;provider_name goblok banget sih sekarang provider_name hashtag jadi murah an hashtag;['provider_name', 'goblok', 'banget', 'sih', 'sekarang', 'provider_name', 'hashtag', 'jadi', 'murah', 'an', 'hashtag'];['provider_name', 'bodoh', 'banget', 'sih', 'sekarang', 'provider_name', 'hashtag', 'jadi', 'murah', 'an', 'hashtag'];['provider_name', 'bodoh', 'banget', 'sih', 'provider_name', 'hashtag', 'murah', 'an', 'hashtag'];provider_name bodoh banget sih provider_name hashtag murah an hashtag;provider name bodoh banget sih provider name hashtag murah an hashtag
228;0;Padahal udah settingan 3G tapi kenapa kuota 3G tidak bisa dipakai malah menguras pulsa yaa? #Tanya <PROVIDER_NAME>;padahal udah settingan 3 tapi kenapa kuota 3 tidak bisa dipakai malah menguras pulsa yaa hashtag tanya hashtag provider_name;['padahal', 'udah', 'settingan', '3', 'tapi', 'kenapa', 'kuota', '3', 'tidak', 'bisa', 'dipakai', 'malah', 'menguras', 'pulsa', 'yaa', 'hashtag', 'tanya', 'hashtag', 'provider_name'];['padahal', 'sudah', 'settingan', '3', 'tapi', 'kenapa', 'kuota', '3', 'tidak', 'bisa', 'dipakai', 'malah', 'menguras', 'pulsa', 'iya', 'hashtag', 'tanya', 'hashtag', 'provider_name'];['settingan', '3', 'kuota', '3', 'dipakai', 'menguras', 'pulsa', 'iya', 'hashtag', 'hashtag', 'provider_name'];settingan 3 kuota 3 dipakai menguras pulsa iya hashtag hashtag provider_name;settingan 3 kuota 3 pakai uras pulsa iya hashtag hashtag provider name
229;0;Sudah mahal sinyalnya jelek lagi... <PROVIDER_NAME> bangsat anjing...;sudah mahal sinyalnya jelek lagi repeated provider_name bangsat anjing repeated;['sudah', 'mahal', 'sinyalnya', 'jelek', 'lagi', 'repeated', 'provider_name', 'bangsat', 'anjing', 'repeated'];['sudah', 'mahal', 'sinyalnya', 'jelek', 'lagi', 'repeated', 'provider_name', 'bangsat', 'anjing', 'repeated'];['mahal', 'sinyalnya', 'jelek', 'repeated', 'provider_name', 'bangsat', 'anjing', 'repeated'];mahal sinyalnya jelek repeated provider_name bangsat anjing repeated;mahal sinyal jelek repeated provider name bangsat anjing repeated
230;0;Jeleknya jaringan internet. <PROVIDER_NAME>;jeleknya jaringan internet provider_name;['jeleknya', 'jaringan', 'internet', 'provider_name'];['jeleknya', 'jaringan', 'internet', 'provider_name'];['jeleknya', 'jaringan', 'internet', 'provider_name'];jeleknya jaringan internet provider_name;jelek jaring internet provider name
231;0;Cuma di area Pandeglang kota.. jaringan <PROVIDER_NAME> buruk jelek. Kejadian ini sudah berlangsung sebulan lamanya. <PROVIDER_NAME>Care <PROVIDER_NAME>payah <PROVIDER_NAME> harus dihack;cuma di area pandeglang kota repeated jaringan provider_name buruk jelek kejadian ini sudah berlangsung sebulan lamanya provider_name care provider_name payah provider_name harus dihack;['cuma', 'di', 'area', 'pandeglang', 'kota', 'repeated', 'jaringan', 'provider_name', 'buruk', 'jelek', 'kejadian', 'ini', 'sudah', 'berlangsung', 'sebulan', 'lamanya', 'provider_name', 'care', 'provider_name', 'payah', 'provider_name', 'harus', 'dihack'];['cuma', 'di', 'area', 'pandeglang', 'kota', 'repeated', 'jaringan', 'provider_name', 'buruk', 'jelek', 'kejadian', 'ini', 'sudah', 'berlangsung', 'sebulan', 'lamanya', 'provider_name', 'care', 'provider_name', 'payah', 'provider_name', 'harus', 'dihack'];['area', 'pandeglang', 'kota', 'repeated', 'jaringan', 'provider_name', 'buruk', 'jelek', 'kejadian', 'sebulan', 'provider_name', 'care', 'provider_name', 'payah', 'provider_name', 'dihack'];area pandeglang kota repeated jaringan provider_name buruk jelek kejadian sebulan provider_name care provider_name payah provider_name dihack;area pandeglang kota repeated jaring provider name buruk jelek jadi bulan provider name care provider name payah provider name dihack
232;0;benar2 kacau. Baru isi kuota, datanya langsung habis. <PROVIDER_NAME> ;benar2 kacau baru isi kuota datanya langsung habis provider_name;['benar2', 'kacau', 'baru', 'isi', 'kuota', 'datanya', 'langsung', 'habis', 'provider_name'];['benar2', 'kacau', 'baru', 'isi', 'kuota', 'datanya', 'langsung', 'habis', 'provider_name'];['benar2', 'kacau', 'isi', 'kuota', 'datanya', 'langsung', 'habis', 'provider_name'];benar2 kacau isi kuota datanya langsung habis provider_name;benar2 kacau isi kuota data langsung habis provider name
233;1;<PROVIDER_NAME> ayo kamu bisa;provider_name ayo kamu bisa;['provider_name', 'ayo', 'kamu', 'bisa'];['provider_name', 'ayo', 'kamu', 'bisa'];['provider_name', 'ayo'];provider_name ayo;provider name ayo
234;1;Mending ngopi nyantai sambil dengar musik klasik di youtube gratis dari jaringan <PROVIDER_NAME> yang keren;mending ngopi nyantai sambil dengar musik klasik di youtube gratis dari jaringan provider_name yang keren;['mending', 'ngopi', 'nyantai', 'sambil', 'dengar', 'musik', 'klasik', 'di', 'youtube', 'gratis', 'dari', 'jaringan', 'provider_name', 'yang', 'keren'];['baiknya', 'ngopi', 'nyantai', 'sambil', 'dengar', 'musik', 'klasik', 'di', 'youtube', 'gratis', 'dari', 'jaringan', 'provider_name', 'yang', 'keren'];['baiknya', 'ngopi', 'nyantai', 'dengar', 'musik', 'klasik', 'youtube', 'gratis', 'jaringan', 'provider_name', 'keren'];baiknya ngopi nyantai dengar musik klasik youtube gratis jaringan provider_name keren;baik ngopi nyantai dengar musik klasik youtube gratis jaring provider name keren
235;1;ada banyak fitur  dari Kartu Perdana <PROVIDER_NAME> yg udah 4.5G <PROVIDER_NAME>Youtube1tahun <PROVIDER_NAME>_Jabo <USER_MENTION>;ada banyak fitur dari kartu perdana provider_name yg udah number 5 provider_name youtube1tahun provider_name _jabo user_mention;['ada', 'banyak', 'fitur', 'dari', 'kartu', 'perdana', 'provider_name', 'yg', 'udah', 'number', '5', 'provider_name', 'youtube1tahun', 'provider_name', '_jabo', 'user_mention'];['ada', 'banyak', 'fitur', 'dari', 'kartu', 'perdana', 'provider_name', 'yang', 'sudah', 'number', '5', 'provider_name', 'youtube1tahun', 'provider_name', '_jabo', 'user_mention'];['fitur', 'kartu', 'perdana', 'provider_name', 'number', '5', 'provider_name', 'youtube1tahun', 'provider_name', '_jabo', 'user_mention'];fitur kartu perdana provider_name number 5 provider_name youtube1tahun provider_name _jabo user_mention;fitur kartu perdana provider name number 5 provider name youtube1tahun provider name jabo user mention
